Domande,Risposte
Quanti ristoranti ci sono con delle stelle michelin a Torino e dove si trovano?,"A Torino (e provincia) se ne trovano sedici, tutti con una sola stella. Undici si trovano in città, mentre cinque sono fuori, sparsi tra Caluso, Pinerolo, San Maurizio Canavese e Venaria Reale."
Quali sono i ristoranti stellati di torino che hanno almeno un menù degustazione costa meno di 100 euro? ,"Andrea Larossa: Turin Pop a 87 euro, Condividere: I classici a 90 euro, Dolce Stil Novo: Gourmet Carta Bianca a 90 euro, Spazio7: Menu3portate a 85 euro, Vintage 1967: Vegetariano, Territorio, Mediterraneo a 75 euro, piccoli menu vintage (pranzo) a 30 euro, "
Qual'è il minimo che bisogna spendere per una degustazione stellata a Torino?,"30 euro, piccoli menu vintage (pranzo) al ristorante Vintage 1997"
Quali piatti rappresentano l'alta ristorazione torinese?,Il vitello tonnato e il cyber egg: l’alta ristorazione torinese
Quali ristoranti hanno un menù degustazione vegetariano?,"Cannavacciuolo Bistrot, Vintage 1997, Magorabin"
Quale ristorante ha un'esperienza che non ti aspetteresti da un ristorante torinese?,"Unforgettable. Una location suggestiva, in stile speakeasy e un menu creativo che più creativo non si può. Si mangia seduti al bancone, in pochissimi posti, assistendo a quello che in effetti è la deriva della cucina 2.0, lo chef che si fa attore, la gastronomia che si fa spettacolo"
Quali ristoranti hanno a disposizione delle strutture per persone diversamente abili?,"Spazio7, Condividere, Magorabin, Del Cambio, Piano35, Dolce Stil Novo alla Reggia, Cannavacciuolo Bistrot Torino, Ristorante Larossa"
Quali sono i 3 ristoranti con i menù degustazione più costosi?,"260 euro - Menù degustazione del Ristorante Carignano, 220 euro - Menù degustazione tartufo bianco d’alba del ristorante La Credenza, 215 euro - La cucina di Matteo Baronetto in nove momenti del ristorante Del Cambio"
Quali ristoranti sono aperti almeno un giorno a pranzo?,"Cannavacciuolo Bistrot Torino ( tranne martedì ), Casa Vicina, Del Cambio (solo weekend compreso venerdì), Dolce Stil Novo alla Reggia, Magorabin ( solo sabato ), Spazio7 ( solo domenica ), Unforgettable ( solo sabato ), Vintage 1997 ( sabato no )"
Quali ristoranti hanno un menù degustazione con l'opzione di abbinamento vini?,"Piano35, Carignano, Del Cambio, La Credenza"